{
  "dataset": "community-apps",
  "recordCount": 80,
  "records": [
    {
      "classification": "COMMUNITY_APP_LISTED",
      "hpmMatches": [
        {
          "basis": [
            "EXACT_LINK",
            "EXACT_NAME"
          ],
          "packageId": "manifest:cbcfc71e2234994bf2e0",
          "packageName": "Vacation Lighting Director"
        }
      ],
      "id": "community-app:01724fa6874e3c63d4ac",
      "lifecycleFlags": [],
      "links": [
        "https://community.hubitat.com/t/vacation-lighting-anyone-have-it-running/1454/25"
      ],
      "name": "Vacation Lighting Director",
      "raw": {
        "text": "Vacation Lighting Director - link"
      },
      "section": "Lighting Apps and Drivers",
      "source": {
        "item": 70,
        "postNumber": 1,
        "updatedAt": "2024-08-15T10:12:19.442Z",
        "url": "https://community.hubitat.com/t/custom-apps-wiki/501"
      }
    },
    {
      "classification": "COMMUNITY_APP_LISTED",
      "hpmMatches": [],
      "id": "community-app:047572daddf738227a34",
      "lifecycleFlags": [],
      "links": [
        "https://community.hubitat.com/t/new-homebridge-plug-in-via-makerapi-and-eventsocket/13949"
      ],
      "name": "Homebridge/Homekit via Maker API",
      "raw": {
        "text": "Homebridge/Homekit via Maker API - link"
      },
      "section": "Integration Apps",
      "source": {
        "item": 20,
        "postNumber": 1,
        "updatedAt": "2024-08-15T10:12:19.442Z",
        "url": "https://community.hubitat.com/t/custom-apps-wiki/501"
      }
    },
    {
      "classification": "COMMUNITY_APP_LISTED",
      "hpmMatches": [],
      "id": "community-app:08a7698da4d61706bf40",
      "lifecycleFlags": [],
      "links": [
        "https://community.hubitat.com/t/release-hubconnect-share-devices-across-multiple-hubs-even-smartthings/12028"
      ],
      "name": "HubConnect - Bi-Directional Device sharing across Hubitat Hubs",
      "raw": {
        "text": "HubConnect - Bi-Directional Device sharing across Hubitat Hubs - link"
      },
      "section": "Multiple Hubitat Hubs / SmartThings Device Integration",
      "source": {
        "item": 41,
        "postNumber": 1,
        "updatedAt": "2024-08-15T10:12:19.442Z",
        "url": "https://community.hubitat.com/t/custom-apps-wiki/501"
      }
    },
    {
      "classification": "COMMUNITY_APP_LISTED",
      "hpmMatches": [
        {
          "basis": [
            "EXACT_LINK"
          ],
          "packageId": "manifest:596fe525858de797502d",
          "packageName": "Enphase Solar"
        }
      ],
      "id": "community-app:1036bf510cab0ceb4743",
      "lifecycleFlags": [],
      "links": [
        "https://community.hubitat.com/t/enphase-solar-monitoring/6241/8"
      ],
      "name": "Enphase Envoy Solar Monitoring",
      "raw": {
        "text": "Enphase Envoy Solar Monitoring - link"
      },
      "section": "Integration Apps",
      "source": {
        "item": 15,
        "postNumber": 1,
        "updatedAt": "2024-08-15T10:12:19.442Z",
        "url": "https://community.hubitat.com/t/custom-apps-wiki/501"
      }
    },
    {
      "classification": "COMMUNITY_APP_LISTED",
      "hpmMatches": [
        {
          "basis": [
            "EXACT_LINK"
          ],
          "packageId": "hpm:4611a36f-d271-4e2b-ab89-55a41a5ab133",
          "packageName": "HubiThings Replica"
        }
      ],
      "id": "community-app:16ef9b9570320d8f72bb",
      "lifecycleFlags": [],
      "links": [
        "https://community.hubitat.com/t/release-hubithings-replica/107976"
      ],
      "name": "HubiThings Replica - Bi-Directional sharing between SmartThings and Hubitat",
      "raw": {
        "text": "HubiThings Replica - Bi-Directional sharing between SmartThings and Hubitat - link"
      },
      "section": "Multiple Hubitat Hubs / SmartThings Device Integration",
      "source": {
        "item": 42,
        "postNumber": 1,
        "updatedAt": "2024-08-15T10:12:19.442Z",
        "url": "https://community.hubitat.com/t/custom-apps-wiki/501"
      }
    },
    {
      "classification": "COMMUNITY_APP_LISTED",
      "hpmMatches": [],
      "id": "community-app:1776e83e5625b90f53ec",
      "lifecycleFlags": [],
      "links": [
        "https://community.hubitat.com/t/twilio-notifications-driver-supports-sms-and-voice-calls/1676"
      ],
      "name": "Twilio Notifications Driver - Supports SMS and Voice Calls",
      "raw": {
        "text": "Twilio Notifications Driver - Supports SMS and Voice Calls - link"
      },
      "section": "Notifications on your Smartphone or Browser",
      "source": {
        "item": 39,
        "postNumber": 1,
        "updatedAt": "2024-08-15T10:12:19.442Z",
        "url": "https://community.hubitat.com/t/custom-apps-wiki/501"
      }
    },
    {
      "classification": "COMMUNITY_APP_LISTED",
      "hpmMatches": [],
      "id": "community-app:1a2ec13e281dcaf62b8d",
      "lifecycleFlags": [],
      "links": [
        "https://github.com/krlaframboise/OtherHub2/tree/master/smartapps/krlaframboise/other-hub-device-viewer.src"
      ],
      "name": "SmartThings OtherHub2 Device Viewer SmartApp",
      "raw": {
        "text": "SmartThings OtherHub2 Device Viewer SmartApp - link"
      },
      "section": "Multiple Hubitat Hubs / SmartThings Device Integration",
      "source": {
        "item": 46,
        "postNumber": 1,
        "updatedAt": "2024-08-15T10:12:19.442Z",
        "url": "https://community.hubitat.com/t/custom-apps-wiki/501"
      }
    },
    {
      "classification": "COMMUNITY_APP_LISTED",
      "hpmMatches": [
        {
          "basis": [
            "EXACT_LINK"
          ],
          "packageId": "hpm:23b507e6-22ac-4a4e-bcda-f1969c174cd6",
          "packageName": "Lumos"
        },
        {
          "basis": [
            "EXACT_LINK",
            "EXACT_NAME"
          ],
          "packageId": "hpm:46ce50b6-6513-4ae9-b4a3-1d392294b35f",
          "packageName": "Zigbee Map"
        }
      ],
      "id": "community-app:22d9c1d7e2597e342ec5",
      "lifecycleFlags": [],
      "links": [
        "https://community.hubitat.com/t/release-zigbee-map-app/133888"
      ],
      "name": "Zigbee Map",
      "raw": {
        "text": "Zigbee Map - link"
      },
      "section": "Debugging and Monitoring",
      "source": {
        "item": 80,
        "postNumber": 1,
        "updatedAt": "2024-08-15T10:12:19.442Z",
        "url": "https://community.hubitat.com/t/custom-apps-wiki/501"
      }
    },
    {
      "classification": "COMMUNITY_APP_LISTED",
      "hpmMatches": [],
      "id": "community-app:24cacb5fc10b71b4885b",
      "lifecycleFlags": [],
      "links": [
        "https://community.hubitat.com/t/blebox-device-integration/20476"
      ],
      "name": "BleBox",
      "raw": {
        "text": "BleBox - link"
      },
      "section": "Integration Apps",
      "source": {
        "item": 11,
        "postNumber": 1,
        "updatedAt": "2024-08-15T10:12:19.442Z",
        "url": "https://community.hubitat.com/t/custom-apps-wiki/501"
      }
    },
    {
      "classification": "COMMUNITY_APP_LISTED",
      "hpmMatches": [],
      "id": "community-app:24d380337d913ec8f81c",
      "lifecycleFlags": [],
      "links": [
        "https://community.hubitat.com/t/release-app-circadian-daylight-v0-72-port/5770/60"
      ],
      "name": "Circadian Daylight",
      "raw": {
        "text": "Circadian Daylight - link"
      },
      "section": "Lighting Apps and Drivers",
      "source": {
        "item": 67,
        "postNumber": 1,
        "updatedAt": "2024-08-15T10:12:19.442Z",
        "url": "https://community.hubitat.com/t/custom-apps-wiki/501"
      }
    },
    {
      "classification": "COMMUNITY_APP_LISTED",
      "hpmMatches": [
        {
          "basis": [
            "EXACT_NAME"
          ],
          "packageId": "manifest:bfbba37464ba084b47ce",
          "packageName": "Lockdown"
        }
      ],
      "id": "community-app:29ccfe80bbe7642e32cb",
      "lifecycleFlags": [],
      "links": [
        "https://community.hubitat.com/t/release-lockdown/8866"
      ],
      "name": "Lockdown",
      "raw": {
        "text": "Lockdown - link"
      },
      "section": "Custom Control Apps",
      "source": {
        "item": 58,
        "postNumber": 1,
        "updatedAt": "2024-08-15T10:12:19.442Z",
        "url": "https://community.hubitat.com/t/custom-apps-wiki/501"
      }
    },
    {
      "classification": "COMMUNITY_APP_LISTED",
      "hpmMatches": [],
      "id": "community-app:2c65ddaaee7bcc0c6d90",
      "lifecycleFlags": [],
      "links": [
        "https://community.hubitat.com/t/release-hubitat-dashboard-android-dashboard-app/41674"
      ],
      "name": "Hubitat Dashboard Android App",
      "raw": {
        "text": "Hubitat Dashboard Android App - link"
      },
      "section": "Dashboard Apps",
      "source": {
        "item": 8,
        "postNumber": 1,
        "updatedAt": "2024-08-15T10:12:19.442Z",
        "url": "https://community.hubitat.com/t/custom-apps-wiki/501"
      }
    },
    {
      "classification": "COMMUNITY_APP_LISTED",
      "hpmMatches": [],
      "id": "community-app:2cefba79c846c518afa0",
      "lifecycleFlags": [],
      "links": [
        "https://community.hubitat.com/t/port-hubitat-mqtt-bridge/"
      ],
      "name": "Hubitat MQTT Bridge",
      "raw": {
        "text": "Hubitat MQTT Bridge - link"
      },
      "section": "Integration Apps",
      "source": {
        "item": 21,
        "postNumber": 1,
        "updatedAt": "2024-08-15T10:12:19.442Z",
        "url": "https://community.hubitat.com/t/custom-apps-wiki/501"
      }
    },
    {
      "classification": "COMMUNITY_APP_LISTED",
      "hpmMatches": [],
      "id": "community-app:2f4bffbe1aade7ee15d5",
      "lifecycleFlags": [],
      "links": [
        "https://community.hubitat.com/t/release-garage-opener-app-beta/37444"
      ],
      "name": "Garage Opener",
      "raw": {